{
  "$schema": "./course.config.schema.json",
  "schemaVersion": 1,
  "course": {
    "name": "Trabalho de Conclusão de Curso II",
    "acronym": "TCCII",
    "code": "INF03094 ",
    "program": "Bacharelado em Sistemas de Informação",
    "institution": {
      "name": "IF Sudeste MG",
      "campus": "Campus Manhuaçu",
      "url": "https://www.ifsudestemg.edu.br/manhuacu"
    },
    "modality": "Presencial",
    "workloadHours": 30,
    "instructor": {
      "name": "Filipe Fernandes, PhD",
      "url": "https://filipefernandesphd.com"
    }
  },
  "repository": {
    "provider": "github",
    "owner": "filipefernandesphd",
    "name": "TCCII",
    "url": "https://github.com/filipefernandesphd/TCCII"
  },
  "site": {
    "currentSemester": "2026.2",
    "locale": "pt-BR",
    "timezone": "America/Sao_Paulo"
  },
  "slides": {
    "templateRepository": "git@github.com:filipefernandesphd/my-slidev-template.git",
    "templateRevision": "91a065af159793f66d8d30cd3bc887fb121b3150"
  }
}
